{
  "schema_version": 1,
  "provenance": {
    "method": "reviewed-baseline",
    "sources": [
      "backend/app/core/config.py",
      "backend/alembic/versions/",
      "backend/app/services/rag/vectorstore.py",
      "backend/app/services/rag/embedding_cache.py",
      "backend/app/worker/taskiq_app.py",
      "docker-compose.yml"
    ],
    "extractor_version": "1.0.0"
  },
  "postgres": {
    "migrations": {
      "provenance": {
        "method": "reviewed-baseline",
        "sources": ["backend/alembic/versions/"],
        "extractor_version": "1.0.0"
      },
      "head_expected": ["0029_mcp_connect_url"],
      "heads_observed": ["0029_mcp_connect_url"],
      "revisions": [],
      "accepted_history_ref": "alembic-numbering-gaps-accepted"
    },
    "dimension_contract": {
      "expected": 1024,
      "points": [
        {
          "id": "settings",
          "location": "backend/app/core/config.py EMBEDDING_DIMENSION",
          "observed": 1024
        },
        {
          "id": "vectorstore-guard",
          "location": "backend/app/services/rag/vectorstore.py dimension guard, vector(1024) DDL, and the HNSW index",
          "observed": 1024
        },
        {
          "id": "migration-check",
          "location": "backend/alembic/versions/ revision 0027_embedding_cache CHECK constraint",
          "observed": 1024
        },
        {
          "id": "collection-fingerprint",
          "location": "backend/app/services/rag/vectorstore.py per-collection embedding_fingerprint, validated when a collection is opened",
          "observed": "fingerprint includes the dimension"
        },
        {
          "id": "cache-key-version",
          "location": "backend/app/services/rag/embedding_cache.py versioned key over dimensions, input kind, instruction, normalized input, model id, and model version",
          "observed": "dimension participates in the key"
        }
      ]
    },
    "tables": [
      {
        "name": "organizations",
        "purpose": "Generated by the billing feature set, which is disabled",
        "classification": "generator-provided-unused",
        "generator_feature": "enable_billing"
      },
      {
        "name": "plans",
        "purpose": "Billing plan catalogue",
        "classification": "generator-provided-unused",
        "generator_feature": "enable_billing"
      },
      {
        "name": "subscriptions",
        "purpose": "Billing subscriptions",
        "classification": "generator-provided-unused",
        "generator_feature": "enable_billing"
      },
      {
        "name": "stripe_events",
        "purpose": "Payment webhook ledger",
        "classification": "generator-provided-unused",
        "generator_feature": "enable_billing"
      },
      {
        "name": "credits_usage",
        "purpose": "Credit accounting",
        "classification": "generator-provided-unused",
        "generator_feature": "enable_billing"
      },
      {
        "name": "mcp_connections",
        "purpose": "Per-user MCP connections. The only place the per-user privileged tool surface exists; the url column is unencrypted while auth_token is Fernet-encrypted, and allowed_tools NULL means every advertised tool.",
        "classification": "application"
      }
    ]
  },
  "redis": {
    "databases": [
      {
        "db": 0,
        "purpose": "General application cache",
        "declared_by": "REDIS_DB",
        "consumers": ["backend-api"]
      },
      {
        "db": 1,
        "purpose": "Taskiq broker queue",
        "declared_by": "TASKIQ_BROKER_URL",
        "consumers": ["backend-api"]
      },
      {
        "db": 2,
        "purpose": "Taskiq result backend",
        "declared_by": "TASKIQ_RESULT_BACKEND",
        "consumers": ["backend-api"]
      },
      {
        "db": 3,
        "purpose": "Embedding cache level one",
        "declared_by": "EMBEDDING_CACHE_URL",
        "consumers": ["rag"]
      }
    ]
  },
  "embedding_cache": {
    "l1": {
      "redis_db": 3,
      "ttl_env_ref": "EMBEDDING_CACHE_TTL_SECONDS"
    },
    "l2": {
      "table": "embedding_cache",
      "location": "backend/app/services/rag/embedding_cache.py, created by revision 0027_embedding_cache",
      "key_fields": [
        "dimensions",
        "input_kind",
        "instruction",
        "normalized_input",
        "model_id",
        "model_version"
      ]
    }
  },
  "s3": {
    "buckets": [
      {
        "name": "fullstack",
        "purpose": "General uploaded media",
        "endpoint_ref": "S3_ENDPOINT",
        "credentials_ref": ["S3_ACCESS_KEY", "S3_SECRET_KEY"]
      },
      {
        "name": "fullstack-rag",
        "purpose": "RAG source documents. Deliberately separate from the general bucket, with its own endpoint and credentials, so a misconfiguration cannot merge user media into the corpus.",
        "endpoint_ref": "S3_RAG_ENDPOINT",
        "credentials_ref": ["S3_RAG_ACCESS_KEY", "S3_RAG_SECRET_KEY"]
      }
    ]
  },
  "volumes": [
    {"name": "postgres_data", "class": "named", "backup": "required"},
    {"name": "minio_data", "class": "named", "backup": "required"},
    {"name": "media_data", "class": "named", "backup": "required"},
    {"name": "redis-data", "class": "external-preserve", "backup": "recommended"},
    {"name": "docling-models", "class": "external-preserve", "backup": "not-required"},
    {"name": "models_cache", "class": "named", "backup": "not-required"},
    {"name": "docling_mcp_cache", "class": "named", "backup": "not-required"},
    {"name": "traefik_letsencrypt", "class": "named", "backup": "recommended"}
  ]
}
